<?xml version="1.0" encoding="windows-1251"?>
<DECLAR xmlns:xsi="http://www.w3.org/2001/XMLSchema-instance" xsi:noNamespaceSchemaLocation="J0210401.XSD">
  <DECLARHEAD>
    <TIN>24432974</TIN>
    <C_DOC>J02</C_DOC>
    <C_DOC_SUB>104</C_DOC_SUB>
    <C_DOC_VER>1</C_DOC_VER>
    <C_DOC_TYPE>0</C_DOC_TYPE>
    <C_DOC_CNT>1</C_DOC_CNT>
    <C_REG>28</C_REG>
    <C_RAJ>10</C_RAJ>
    <PERIOD_MONTH>1</PERIOD_MONTH>
    <PERIOD_TYPE>1</PERIOD_TYPE>
    <PERIOD_YEAR>2020</PERIOD_YEAR>
    <C_STI_ORIG>2810</C_STI_ORIG>
    <C_DOC_STAN>1</C_DOC_STAN>
    <LINKED_DOCS xsi:nil="true" />
    <D_FILL>05022020</D_FILL>
    <SOFTWARE>MEDOC</SOFTWARE>
  </DECLARHEAD>
  <DECLARBODY>
    <HZ>1</HZ>
    <HDATE1>01012020</HDATE1>
    <HTIME1>00:00:00</HTIME1>
    <HDATE2>31012020</HDATE2>
    <HTIME2>23:59:59</HTIME2>
    <HTIN>24432974</HTIN>
    <HNAME>ПУБЛІЧНЕ АКЦІОНЕРНЕ ТОВАРИСТВО"АРСЕЛОРМІТТАЛ КРИВИЙ РІГ"</HNAME>
    <R07G1>1005741</R07G1>
    <T1RXXXXG1 ROWNUM="1">1</T1RXXXXG1>
    <T1RXXXXG1 ROWNUM="2">2</T1RXXXXG1>
    <T1RXXXXG1 ROWNUM="3">3</T1RXXXXG1>
    <T1RXXXXG1 ROWNUM="4">4</T1RXXXXG1>
    <T1RXXXXG1 ROWNUM="5">5</T1RXXXXG1>
    <T1RXXXXG1 ROWNUM="6">6</T1RXXXXG1>
    <T1RXXXXG1 ROWNUM="7">7</T1RXXXXG1>
    <T1RXXXXG1 ROWNUM="8">8</T1RXXXXG1>
    <T1RXXXXG1 ROWNUM="9">9</T1RXXXXG1>
    <T1RXXXXG1 ROWNUM="10">10</T1RXXXXG1>
    <T1RXXXXG1 ROWNUM="11">11</T1RXXXXG1>
    <T1RXXXXG1 ROWNUM="12">12</T1RXXXXG1>
    <T1RXXXXG1 ROWNUM="13">13</T1RXXXXG1>
    <T1RXXXXG1 ROWNUM="14">14</T1RXXXXG1>
    <T1RXXXXG1 ROWNUM="15">15</T1RXXXXG1>
    <T1RXXXXG1 ROWNUM="16">16</T1RXXXXG1>
    <T1RXXXXG1 ROWNUM="17">17</T1RXXXXG1>
    <T1RXXXXG1 ROWNUM="18">18</T1RXXXXG1>
    <T1RXXXXG1 ROWNUM="19">19</T1RXXXXG1>
    <T1RXXXXG1 ROWNUM="20">20</T1RXXXXG1>
    <T1RXXXXG1 ROWNUM="21">21</T1RXXXXG1>
    <T1RXXXXG1 ROWNUM="22">22</T1RXXXXG1>
    <T1RXXXXG1 ROWNUM="23">23</T1RXXXXG1>
    <T1RXXXXG1 ROWNUM="24">24</T1RXXXXG1>
    <T1RXXXXG1 ROWNUM="25">25</T1RXXXXG1>
    <T1RXXXXG1 ROWNUM="26">26</T1RXXXXG1>
    <T1RXXXXG1 ROWNUM="27">27</T1RXXXXG1>
    <T1RXXXXG1 ROWNUM="28">28</T1RXXXXG1>
    <T1RXXXXG1 ROWNUM="29">29</T1RXXXXG1>
    <T1RXXXXG1 ROWNUM="30">30</T1RXXXXG1>
    <T1RXXXXG1 ROWNUM="31">31</T1RXXXXG1>
    <T1RXXXXG1 ROWNUM="32">32</T1RXXXXG1>
    <T1RXXXXG1 ROWNUM="33">33</T1RXXXXG1>
    <T1RXXXXG1 ROWNUM="34">34</T1RXXXXG1>
    <T1RXXXXG1 ROWNUM="35">35</T1RXXXXG1>
    <T1RXXXXG1 ROWNUM="36">36</T1RXXXXG1>
    <T1RXXXXG1 ROWNUM="37">37</T1RXXXXG1>
    <T1RXXXXG1 ROWNUM="38">38</T1RXXXXG1>
    <T1RXXXXG1 ROWNUM="39">39</T1RXXXXG1>
    <T1RXXXXG1 ROWNUM="40">40</T1RXXXXG1>
    <T1RXXXXG1 ROWNUM="41">41</T1RXXXXG1>
    <T1RXXXXG1 ROWNUM="42">42</T1RXXXXG1>
    <T1RXXXXG1 ROWNUM="43">43</T1RXXXXG1>
    <T1RXXXXG1 ROWNUM="44">44</T1RXXXXG1>
    <T1RXXXXG1 ROWNUM="45">45</T1RXXXXG1>
    <T1RXXXXG1 ROWNUM="46">46</T1RXXXXG1>
    <T1RXXXXG1 ROWNUM="47">47</T1RXXXXG1>
    <T1RXXXXG1 ROWNUM="48">48</T1RXXXXG1>
    <T1RXXXXG1 ROWNUM="49">49</T1RXXXXG1>
    <T1RXXXXG1 ROWNUM="50">50</T1RXXXXG1>
    <T1RXXXXG1 ROWNUM="51">51</T1RXXXXG1>
    <T1RXXXXG1 ROWNUM="52">52</T1RXXXXG1>
    <T1RXXXXG1 ROWNUM="53">53</T1RXXXXG1>
    <T1RXXXXG1 ROWNUM="54">54</T1RXXXXG1>
    <T1RXXXXG1 ROWNUM="55">55</T1RXXXXG1>
    <T1RXXXXG1 ROWNUM="56">56</T1RXXXXG1>
    <T1RXXXXG1 ROWNUM="57">57</T1RXXXXG1>
    <T1RXXXXG1 ROWNUM="58">58</T1RXXXXG1>
    <T1RXXXXG2 ROWNUM="1">2710194300</T1RXXXXG2>
    <T1RXXXXG2 ROWNUM="2">2710194300</T1RXXXXG2>
    <T1RXXXXG2 ROWNUM="3">2710194300</T1RXXXXG2>
    <T1RXXXXG2 ROWNUM="4">2710194300</T1RXXXXG2>
    <T1RXXXXG2 ROWNUM="5">2710194300</T1RXXXXG2>
    <T1RXXXXG2 ROWNUM="6">2710194300</T1RXXXXG2>
    <T1RXXXXG2 ROWNUM="7">2710194300</T1RXXXXG2>
    <T1RXXXXG2 ROWNUM="8">2710194300</T1RXXXXG2>
    <T1RXXXXG2 ROWNUM="9">2710194300</T1RXXXXG2>
    <T1RXXXXG2 ROWNUM="10">2710194300</T1RXXXXG2>
    <T1RXXXXG2 ROWNUM="11">2710194300</T1RXXXXG2>
    <T1RXXXXG2 ROWNUM="12">2710194300</T1RXXXXG2>
    <T1RXXXXG2 ROWNUM="13">2710194300</T1RXXXXG2>
    <T1RXXXXG2 ROWNUM="14">2710194300</T1RXXXXG2>
    <T1RXXXXG2 ROWNUM="15">2710194300</T1RXXXXG2>
    <T1RXXXXG2 ROWNUM="16">2710194300</T1RXXXXG2>
    <T1RXXXXG2 ROWNUM="17">2710194300</T1RXXXXG2>
    <T1RXXXXG2 ROWNUM="18">2710194300</T1RXXXXG2>
    <T1RXXXXG2 ROWNUM="19">2710194300</T1RXXXXG2>
    <T1RXXXXG2 ROWNUM="20">2710194300</T1RXXXXG2>
    <T1RXXXXG2 ROWNUM="21">2710194300</T1RXXXXG2>
    <T1RXXXXG2 ROWNUM="22">2710194300</T1RXXXXG2>
    <T1RXXXXG2 ROWNUM="23">2710194300</T1RXXXXG2>
    <T1RXXXXG2 ROWNUM="24">2710194300</T1RXXXXG2>
    <T1RXXXXG2 ROWNUM="25">2710194300</T1RXXXXG2>
    <T1RXXXXG2 ROWNUM="26">2710194300</T1RXXXXG2>
    <T1RXXXXG2 ROWNUM="27">2710194300</T1RXXXXG2>
    <T1RXXXXG2 ROWNUM="28">2710194300</T1RXXXXG2>
    <T1RXXXXG2 ROWNUM="29">2710194300</T1RXXXXG2>
    <T1RXXXXG2 ROWNUM="30">2710194300</T1RXXXXG2>
    <T1RXXXXG2 ROWNUM="31">2710194300</T1RXXXXG2>
    <T1RXXXXG2 ROWNUM="32">2710194300</T1RXXXXG2>
    <T1RXXXXG2 ROWNUM="33" xsi:nil="true" />
    <T1RXXXXG2 ROWNUM="34" xsi:nil="true" />
    <T1RXXXXG2 ROWNUM="35" xsi:nil="true" />
    <T1RXXXXG2 ROWNUM="36" xsi:nil="true" />
    <T1RXXXXG2 ROWNUM="37" xsi:nil="true" />
    <T1RXXXXG2 ROWNUM="38" xsi:nil="true" />
    <T1RXXXXG2 ROWNUM="39">2710192100</T1RXXXXG2>
    <T1RXXXXG2 ROWNUM="40">2710192100</T1RXXXXG2>
    <T1RXXXXG2 ROWNUM="41">2710192100</T1RXXXXG2>
    <T1RXXXXG2 ROWNUM="42" xsi:nil="true" />
    <T1RXXXXG2 ROWNUM="43" xsi:nil="true" />
    <T1RXXXXG2 ROWNUM="44" xsi:nil="true" />
    <T1RXXXXG2 ROWNUM="45" xsi:nil="true" />
    <T1RXXXXG2 ROWNUM="46" xsi:nil="true" />
    <T1RXXXXG2 ROWNUM="47" xsi:nil="true" />
    <T1RXXXXG2 ROWNUM="48" xsi:nil="true" />
    <T1RXXXXG2 ROWNUM="49" xsi:nil="true" />
    <T1RXXXXG2 ROWNUM="50" xsi:nil="true" />
    <T1RXXXXG2 ROWNUM="51" xsi:nil="true" />
    <T1RXXXXG2 ROWNUM="52" xsi:nil="true" />
    <T1RXXXXG2 ROWNUM="53" xsi:nil="true" />
    <T1RXXXXG2 ROWNUM="54" xsi:nil="true" />
    <T1RXXXXG2 ROWNUM="55" xsi:nil="true" />
    <T1RXXXXG2 ROWNUM="56" xsi:nil="true" />
    <T1RXXXXG2 ROWNUM="57" xsi:nil="true" />
    <T1RXXXXG2 ROWNUM="58" xsi:nil="true" />
    <T1RXXXXG3S ROWNUM="1">Важкі дистиляти (газойлі)</T1RXXXXG3S>
    <T1RXXXXG3S ROWNUM="2">Важкі дистиляти (газойлі)</T1RXXXXG3S>
    <T1RXXXXG3S ROWNUM="3">Важкі дистиляти (газойлі)</T1RXXXXG3S>
    <T1RXXXXG3S ROWNUM="4">Важкі дистиляти (газойлі)</T1RXXXXG3S>
    <T1RXXXXG3S ROWNUM="5">Важкі дистиляти (газойлі)</T1RXXXXG3S>
    <T1RXXXXG3S ROWNUM="6">Важкі дистиляти (газойлі)</T1RXXXXG3S>
    <T1RXXXXG3S ROWNUM="7">Важкі дистиляти (газойлі)</T1RXXXXG3S>
    <T1RXXXXG3S ROWNUM="8">Важкі дистиляти (газойлі)</T1RXXXXG3S>
    <T1RXXXXG3S ROWNUM="9">Важкі дистиляти (газойлі)</T1RXXXXG3S>
    <T1RXXXXG3S ROWNUM="10">Важкі дистиляти (газойлі)</T1RXXXXG3S>
    <T1RXXXXG3S ROWNUM="11">Важкі дистиляти (газойлі)</T1RXXXXG3S>
    <T1RXXXXG3S ROWNUM="12">Важкі дистиляти (газойлі)</T1RXXXXG3S>
    <T1RXXXXG3S ROWNUM="13">Важкі дистиляти (газойлі)</T1RXXXXG3S>
    <T1RXXXXG3S ROWNUM="14">Важкі дистиляти (газойлі)</T1RXXXXG3S>
    <T1RXXXXG3S ROWNUM="15">Важкі дистиляти (газойлі)</T1RXXXXG3S>
    <T1RXXXXG3S ROWNUM="16">Важкі дистиляти (газойлі)</T1RXXXXG3S>
    <T1RXXXXG3S ROWNUM="17">Важкі дистиляти (газойлі)</T1RXXXXG3S>
    <T1RXXXXG3S ROWNUM="18">Важкі дистиляти (газойлі)</T1RXXXXG3S>
    <T1RXXXXG3S ROWNUM="19">Важкі дистиляти (газойлі)</T1RXXXXG3S>
    <T1RXXXXG3S ROWNUM="20">Важкі дистиляти (газойлі)</T1RXXXXG3S>
    <T1RXXXXG3S ROWNUM="21">Важкі дистиляти (газойлі)</T1RXXXXG3S>
    <T1RXXXXG3S ROWNUM="22">Важкі дистиляти (газойлі)</T1RXXXXG3S>
    <T1RXXXXG3S ROWNUM="23">Важкі дистиляти (газойлі)</T1RXXXXG3S>
    <T1RXXXXG3S ROWNUM="24">Важкі дистиляти (газойлі)</T1RXXXXG3S>
    <T1RXXXXG3S ROWNUM="25">Важкі дистиляти (газойлі)</T1RXXXXG3S>
    <T1RXXXXG3S ROWNUM="26">Важкі дистиляти (газойлі)</T1RXXXXG3S>
    <T1RXXXXG3S ROWNUM="27">Важкі дистиляти (газойлі)</T1RXXXXG3S>
    <T1RXXXXG3S ROWNUM="28">Важкі дистиляти (газойлі)</T1RXXXXG3S>
    <T1RXXXXG3S ROWNUM="29">Важкі дистиляти (газойлі)</T1RXXXXG3S>
    <T1RXXXXG3S ROWNUM="30">Важкі дистиляти (газойлі)</T1RXXXXG3S>
    <T1RXXXXG3S ROWNUM="31">Важкі дистиляти (газойлі)</T1RXXXXG3S>
    <T1RXXXXG3S ROWNUM="32">Важкі дистиляти (газойлі)</T1RXXXXG3S>
    <T1RXXXXG3S ROWNUM="33" xsi:nil="true" />
    <T1RXXXXG3S ROWNUM="34" xsi:nil="true" />
    <T1RXXXXG3S ROWNUM="35" xsi:nil="true" />
    <T1RXXXXG3S ROWNUM="36" xsi:nil="true" />
    <T1RXXXXG3S ROWNUM="37" xsi:nil="true" />
    <T1RXXXXG3S ROWNUM="38" xsi:nil="true" />
    <T1RXXXXG3S ROWNUM="39">Гас: паливо для реактивних двигунів</T1RXXXXG3S>
    <T1RXXXXG3S ROWNUM="40">Гас: паливо для реактивних двигунів</T1RXXXXG3S>
    <T1RXXXXG3S ROWNUM="41">Гас: паливо для реактивних двигунів</T1RXXXXG3S>
    <T1RXXXXG3S ROWNUM="42" xsi:nil="true" />
    <T1RXXXXG3S ROWNUM="43" xsi:nil="true" />
    <T1RXXXXG3S ROWNUM="44" xsi:nil="true" />
    <T1RXXXXG3S ROWNUM="45" xsi:nil="true" />
    <T1RXXXXG3S ROWNUM="46" xsi:nil="true" />
    <T1RXXXXG3S ROWNUM="47" xsi:nil="true" />
    <T1RXXXXG3S ROWNUM="48" xsi:nil="true" />
    <T1RXXXXG3S ROWNUM="49" xsi:nil="true" />
    <T1RXXXXG3S ROWNUM="50" xsi:nil="true" />
    <T1RXXXXG3S ROWNUM="51" xsi:nil="true" />
    <T1RXXXXG3S ROWNUM="52" xsi:nil="true" />
    <T1RXXXXG3S ROWNUM="53" xsi:nil="true" />
    <T1RXXXXG3S ROWNUM="54" xsi:nil="true" />
    <T1RXXXXG3S ROWNUM="55" xsi:nil="true" />
    <T1RXXXXG3S ROWNUM="56" xsi:nil="true" />
    <T1RXXXXG3S ROWNUM="57" xsi:nil="true" />
    <T1RXXXXG3S ROWNUM="58" xsi:nil="true" />
    <T1RXXXXG4 ROWNUM="1" xsi:nil="true" />
    <T1RXXXXG4 ROWNUM="2" xsi:nil="true" />
    <T1RXXXXG4 ROWNUM="3" xsi:nil="true" />
    <T1RXXXXG4 ROWNUM="4" xsi:nil="true" />
    <T1RXXXXG4 ROWNUM="5" xsi:nil="true" />
    <T1RXXXXG4 ROWNUM="6" xsi:nil="true" />
    <T1RXXXXG4 ROWNUM="7" xsi:nil="true" />
    <T1RXXXXG4 ROWNUM="8" xsi:nil="true" />
    <T1RXXXXG4 ROWNUM="9" xsi:nil="true" />
    <T1RXXXXG4 ROWNUM="10" xsi:nil="true" />